B2: PROPOSITION Occupation plage APAL
B3: Hasdrubal Yesmine Hammamet
B4: 2024 / 2025
B6: Libelle | D6: Nombre | E6: Code JORT
E7: Code | F7: m2 / pcs | G7: m2 | H7: NB | I7: Prix | J7: Montant | K7: Total
B8: Parasol de 4m2 | D8: 85 | E8: 1 | F8: 4m2 | H8: 20 | I8: 50 | J8: =H8*I8 -> 1000 | K8: =SUM(J8:J10) -> 6750
H9: 30 | I9: 75 | J9: =H9*I9 -> 2250
H10: 35 | I10: 100 | J10: =H10*I10 -> 3500
B11: Pagotte de 9m2 | D11: 11 | E11: 5 | F11: <=20 | G11: 9 | H11: 11 | I11: 20 | J11: =G11*H11*I11 -> 1980 | K11: =SUM(J11:J12) -> 1980
J12: =G12*H12*I12 -> 0
B13: Buvette | C13: Buvette | D13: 1 | E13: 2 | F13: <=20 | G13: 20 | H13: 1 | I13: 40 | J13: =G13*H13*I13 -> 800 | K13: =SUM(J13:J14) -> 800
J14: =G14*H14*I14 -> 0
C15: Depot equipement | D15: 1 | E15: 5 | F15: <=20 | G15: 14 | H15: 1 | I15: 20 | J15: =G15*H15*I15 -> 280 | K15: =SUM(J15:J16) -> 280
J16: =G16*H16*I16 -> 0
B17: Poste de securité 1,5m2 | D17: 2 | E17: 5 | G17: 2.25 | H17: 2 | I17: 20 | J17: =G17*H17*I17 -> 90 | K17: =SUM(J17:J18) -> 90
K19: =SUM(K8:K18) -> 9900